carnet,nombre,password,Curso 1,Curso 2,Curso 3
200715321,Dale Jim Melendez Herrera,2021!@,775,771,666
201020692,Adolfo Enrique Noriega Godinez,2021!@,772,775,333
201325511,Jose Estuardo Melendez De La Cruz,2021!@,904,984,222
201403885,Kevin Ricardo Pinto Montenegro,2021!@,708,222,555
201602947,Erick Estuardo Muñoz Escalante,2021!@,771,111,888
201700866,Erick Noe Gómez López,2021!@,772,444,999
201700889,Wagner Estuardo Fuentes Quintana,2021!@,981,894,444
201700936,Gabriel Orlando Chinchilla Vasquez,2021!@,777,876,452
201709196,Allan Josué Rafael Morales,2021!@,778,333,674
201800673,Sergio Emilio De León Bucaro,2021!@,781,211,872
201801105,Daniel Eduardo Izas Marroquín,2021!@,788,787,953
201801356,Johatan Ernesto Fuentes Osoy,2021!@,784,664,441
201801683,Juan Carlos Augusto Picholá Monroy,2021!@,754,234,221